@!@!@STARTMSG 2262:0 @!@!@
TLC2 Version 2.16 of 31 December 2020 (rev: cdddf55)
@!@!@ENDMSG 2262 @!@!@
@!@!@STARTMSG 2187:0 @!@!@
Running breadth-first search Model-Checking with fp 88 and seed -1614138843212551563 with 4 workers on 8 cores with 448MB heap and 1004MB offheap memory [pid: 25920] (Windows 10 10.0 amd64, AdoptOpenJDK 14.0.1 x86_64, OffHeapDiskFPSet, DiskStateQueue).
@!@!@ENDMSG 2187 @!@!@
@!@!@STARTMSG 2220:0 @!@!@
Starting SANY...
@!@!@ENDMSG 2220 @!@!@
Parsing file D:\TLA\actor\actor.toolbox\Model_2\MC.tla
Parsing file D:\TLA\actor\actor.toolbox\Model_2\actor.tla
Parsing file D:\TLA\TLAToolbox-1.7.1-win32.win32.x86_64\toolbox\plugins\org.lamport.tlatools_1.0.0.202012311918\tla2sany\StandardModules\TLC.tla
Parsing file D:\TLA\TLAToolbox-1.7.1-win32.win32.x86_64\toolbox\plugins\org.lamport.tlatools_1.0.0.202012311918\tla2sany\StandardModules\Integers.tla
Parsing file D:\TLA\TLAToolbox-1.7.1-win32.win32.x86_64\toolbox\plugins\org.lamport.tlatools_1.0.0.202012311918\tla2sany\StandardModules\Sequences.tla
Parsing file D:\TLA\channels-master\channels-master\ChannelsReliable.tla
Parsing file D:\TLA\TLAToolbox-1.7.1-win32.win32.x86_64\toolbox\plugins\org.lamport.tlatools_1.0.0.202012311918\tla2sany\StandardModules\Naturals.tla
Parsing file D:\TLA\channels-master\channels-master\ChannelsUtils.tla
Parsing file D:\TLA\TLAToolbox-1.7.1-win32.win32.x86_64\toolbox\plugins\org.lamport.tlatools_1.0.0.202012311918\tla2sany\StandardModules\FiniteSets.tla
Semantic processing of module Naturals
Semantic processing of module Sequences
Semantic processing of module FiniteSets
Semantic processing of module TLC
Semantic processing of module Integers
Semantic processing of module ChannelsUtils
Semantic processing of module ChannelsReliable
Semantic processing of module actor
Semantic processing of module MC
@!@!@STARTMSG 2219:0 @!@!@
SANY finished.
@!@!@ENDMSG 2219 @!@!@
@!@!@STARTMSG 2185:0 @!@!@
Starting... (2022-02-20 22:42:45)
@!@!@ENDMSG 2185 @!@!@
@!@!@STARTMSG 2212:0 @!@!@
Implied-temporal checking--satisfiability problem has 1 branches.
@!@!@ENDMSG 2212 @!@!@
@!@!@STARTMSG 2189:0 @!@!@
Computing initial states...
@!@!@ENDMSG 2189 @!@!@
@!@!@STARTMSG 2190:0 @!@!@
Finished computing initial states: 1 distinct state generated at 2022-02-20 22:42:46.
@!@!@ENDMSG 2190 @!@!@
@!@!@STARTMSG 2200:0 @!@!@
Progress(20) at 2022-02-20 22:42:46: 631 states generated, 210 distinct states found, 0 states left on queue.
@!@!@ENDMSG 2200 @!@!@
@!@!@STARTMSG 2192:0 @!@!@
Checking temporal properties for the complete state space with 210 total distinct states at (2022-02-20 22:42:46)
@!@!@ENDMSG 2192 @!@!@
@!@!@STARTMSG 2267:0 @!@!@
Finished checking temporal properties in 00s at 2022-02-20 22:42:46
@!@!@ENDMSG 2267 @!@!@
@!@!@STARTMSG 2193:0 @!@!@
Model checking completed. No error has been found.
  Estimates of the probability that TLC did not check all reachable states
  because two distinct states had the same fingerprint:
  calculated (optimistic):  val = 4.8E-15
@!@!@ENDMSG 2193 @!@!@
@!@!@STARTMSG 2201:0 @!@!@
The coverage statistics at 2022-02-20 22:42:46
@!@!@ENDMSG 2201 @!@!@
@!@!@STARTMSG 2773:0 @!@!@
<Init line 96, col 1 to line 96, col 4 of module actor>: 1:1
@!@!@ENDMSG 2773 @!@!@
@!@!@STARTMSG 2221:0 @!@!@
  line 97, col 9 to line 108, col 56 of module actor: 1
@!@!@ENDMSG 2221 @!@!@
@!@!@STARTMSG 2772:0 @!@!@
<WaitForMessages line 110, col 1 to line 110, col 21 of module actor>: 77:172
@!@!@ENDMSG 2772 @!@!@
@!@!@STARTMSG 2221:0 @!@!@
  line 110, col 29 to line 110, col 56 of module actor: 802
@!@!@ENDMSG 2221 @!@!@
@!@!@STARTMSG 2221:0 @!@!@
  |line 110, col 29 to line 110, col 36 of module actor: 630
@!@!@ENDMSG 2221 @!@!@
@!@!@STARTMSG 2221:0 @!@!@
  line 111, col 32 to line 111, col 57 of module actor: 172
@!@!@ENDMSG 2221 @!@!@
@!@!@STARTMSG 2221:0 @!@!@
  line 112, col 37 to line 114, col 111 of module actor: 33
@!@!@ENDMSG 2221 @!@!@
@!@!@STARTMSG 2221:0 @!@!@
  line 115, col 40 to line 115, col 43 of module actor: 139
@!@!@ENDMSG 2221 @!@!@
@!@!@STARTMSG 2221:0 @!@!@
  line 116, col 40 to line 117, col 75 of module actor: 139
@!@!@ENDMSG 2221 @!@!@
@!@!@STARTMSG 2221:0 @!@!@
  line 118, col 29 to line 118, col 72 of module actor: 172
@!@!@ENDMSG 2221 @!@!@
@!@!@STARTMSG 2221:0 @!@!@
  line 119, col 29 to line 119, col 81 of module actor: 172
@!@!@ENDMSG 2221 @!@!@
@!@!@STARTMSG 2772:0 @!@!@
<ProcessMessage line 121, col 1 to line 121, col 20 of module actor>: 91:196
@!@!@ENDMSG 2772 @!@!@
@!@!@STARTMSG 2221:0 @!@!@
  line 121, col 28 to line 121, col 54 of module actor: 826
@!@!@ENDMSG 2221 @!@!@
@!@!@STARTMSG 2221:0 @!@!@
  |line 121, col 28 to line 121, col 35 of module actor: 630
@!@!@ENDMSG 2221 @!@!@
@!@!@STARTMSG 2221:0 @!@!@
  line 122, col 31 to line 122, col 60 of module actor: 196
@!@!@ENDMSG 2221 @!@!@
@!@!@STARTMSG 2221:0 @!@!@
  line 123, col 39 to line 123, col 89 of module actor: 21
@!@!@ENDMSG 2221 @!@!@
@!@!@STARTMSG 2221:0 @!@!@
  line 124, col 39 to line 124, col 95 of module actor: 21
@!@!@ENDMSG 2221 @!@!@
@!@!@STARTMSG 2221:0 @!@!@
  line 125, col 42 to line 125, col 102 of module actor: 21
@!@!@ENDMSG 2221 @!@!@
@!@!@STARTMSG 2221:0 @!@!@
  |line 4, col 26 to line 4, col 125 of module actor: 21
@!@!@ENDMSG 2221 @!@!@
@!@!@STARTMSG 2221:0 @!@!@
  ||line 4, col 27 to line 4, col 33 of module actor: 21
@!@!@ENDMSG 2221 @!@!@
@!@!@STARTMSG 2221:0 @!@!@
  ||line 4, col 40 to line 4, col 124 of module actor: 21
@!@!@ENDMSG 2221 @!@!@
@!@!@STARTMSG 2221:0 @!@!@
  |||line 4, col 41 to line 4, col 78 of module actor: 21
@!@!@ENDMSG 2221 @!@!@
@!@!@STARTMSG 2221:0 @!@!@
  ||||line 4, col 42 to line 4, col 48 of module actor: 21
@!@!@ENDMSG 2221 @!@!@
@!@!@STARTMSG 2221:0 @!@!@
  ||||line 4, col 55 to line 4, col 77 of module actor: 9
@!@!@ENDMSG 2221 @!@!@
@!@!@STARTMSG 2221:0 @!@!@
  |||line 4, col 85 to line 4, col 123 of module actor: 21
@!@!@ENDMSG 2221 @!@!@
@!@!@STARTMSG 2221:0 @!@!@
  ||||line 4, col 86 to line 4, col 93 of module actor: 21
@!@!@ENDMSG 2221 @!@!@
@!@!@STARTMSG 2221:0 @!@!@
  ||||line 4, col 100 to line 4, col 122 of module actor: 12
@!@!@ENDMSG 2221 @!@!@
@!@!@STARTMSG 2221:0 @!@!@
  |line 125, col 52 to line 125, col 55 of module actor: 21
@!@!@ENDMSG 2221 @!@!@
@!@!@STARTMSG 2221:0 @!@!@
  |line 125, col 58 to line 125, col 66 of module actor: 51
@!@!@ENDMSG 2221 @!@!@
@!@!@STARTMSG 2221:0 @!@!@
  |line 125, col 69 to line 125, col 101 of module actor: 21
@!@!@ENDMSG 2221 @!@!@
@!@!@STARTMSG 2221:0 @!@!@
  line 126, col 47 to line 128, col 55 of module actor: 12
@!@!@ENDMSG 2221 @!@!@
@!@!@STARTMSG 2221:0 @!@!@
  line 129, col 50 to line 129, col 76 of module actor: 9
@!@!@ENDMSG 2221 @!@!@
@!@!@STARTMSG 2221:0 @!@!@
  line 130, col 50 to line 130, col 97 of module actor: 9
@!@!@ENDMSG 2221 @!@!@
@!@!@STARTMSG 2221:0 @!@!@
  line 131, col 50 to line 131, col 71 of module actor: 9
@!@!@ENDMSG 2221 @!@!@
@!@!@STARTMSG 2221:0 @!@!@
  line 132, col 39 to line 132, col 57 of module actor: 21
@!@!@ENDMSG 2221 @!@!@
@!@!@STARTMSG 2221:0 @!@!@
  line 133, col 42 to line 133, col 98 of module actor: 175
@!@!@ENDMSG 2221 @!@!@
@!@!@STARTMSG 2221:0 @!@!@
  |line 133, col 42 to line 133, col 67 of module actor: 175
@!@!@ENDMSG 2221 @!@!@
@!@!@STARTMSG 2221:0 @!@!@
  |line 133, col 72 to line 133, col 98 of module actor: 12
@!@!@ENDMSG 2221 @!@!@
@!@!@STARTMSG 2221:0 @!@!@
  line 134, col 47 to line 134, col 66 of module actor: 12
@!@!@ENDMSG 2221 @!@!@
@!@!@STARTMSG 2221:0 @!@!@
  line 135, col 50 to line 135, col 53 of module actor: 163
@!@!@ENDMSG 2221 @!@!@
@!@!@STARTMSG 2221:0 @!@!@
  line 136, col 50 to line 136, col 68 of module actor: 163
@!@!@ENDMSG 2221 @!@!@
@!@!@STARTMSG 2221:0 @!@!@
  line 137, col 39 to line 137, col 80 of module actor: 175
@!@!@ENDMSG 2221 @!@!@
@!@!@STARTMSG 2221:0 @!@!@
  line 138, col 39 to line 138, col 80 of module actor: 175
@!@!@ENDMSG 2221 @!@!@
@!@!@STARTMSG 2221:0 @!@!@
  line 139, col 28 to line 139, col 77 of module actor: 196
@!@!@ENDMSG 2221 @!@!@
@!@!@STARTMSG 2772:0 @!@!@
<FindFirstSuitableI line 141, col 1 to line 141, col 24 of module actor>: 1:9
@!@!@ENDMSG 2772 @!@!@
@!@!@STARTMSG 2221:0 @!@!@
  line 141, col 32 to line 141, col 62 of module actor: 639
@!@!@ENDMSG 2221 @!@!@
@!@!@STARTMSG 2221:0 @!@!@
  |line 141, col 32 to line 141, col 39 of module actor: 630
@!@!@ENDMSG 2221 @!@!@
@!@!@STARTMSG 2221:0 @!@!@
  line 142, col 35 to line 142, col 109 of module actor: 9
@!@!@ENDMSG 2221 @!@!@
@!@!@STARTMSG 2221:0 @!@!@
  line 143, col 43 to line 143, col 79 of module actor: 0
@!@!@ENDMSG 2221 @!@!@
@!@!@STARTMSG 2221:0 @!@!@
  line 144, col 43 to line 144, col 90 of module actor: 0
@!@!@ENDMSG 2221 @!@!@
@!@!@STARTMSG 2221:0 @!@!@
  line 145, col 40 to line 146, col 48 of module actor: 9
@!@!@ENDMSG 2221 @!@!@
@!@!@STARTMSG 2221:0 @!@!@
  line 147, col 32 to line 149, col 56 of module actor: 9
@!@!@ENDMSG 2221 @!@!@
@!@!@STARTMSG 2772:0 @!@!@
<MainLoop line 151, col 1 to line 151, col 14 of module actor>: 6:18
@!@!@ENDMSG 2772 @!@!@
@!@!@STARTMSG 2221:0 @!@!@
  line 151, col 22 to line 151, col 42 of module actor: 648
@!@!@ENDMSG 2221 @!@!@
@!@!@STARTMSG 2221:0 @!@!@
  |line 151, col 22 to line 151, col 29 of module actor: 630
@!@!@ENDMSG 2221 @!@!@
@!@!@STARTMSG 2221:0 @!@!@
  line 152, col 25 to line 152, col 116 of module actor: 18
@!@!@ENDMSG 2221 @!@!@
@!@!@STARTMSG 2221:0 @!@!@
  |line 152, col 25 to line 152, col 35 of module actor: 18
@!@!@ENDMSG 2221 @!@!@
@!@!@STARTMSG 2221:0 @!@!@
  |line 152, col 40 to line 152, col 116 of module actor: 18
@!@!@ENDMSG 2221 @!@!@
@!@!@STARTMSG 2221:0 @!@!@
  ||line 152, col 42 to line 152, col 115 of module actor: 18
@!@!@ENDMSG 2221 @!@!@
@!@!@STARTMSG 2221:0 @!@!@
  |||line 5, col 26 to line 5, col 123 of module actor: 18
@!@!@ENDMSG 2221 @!@!@
@!@!@STARTMSG 2221:0 @!@!@
  ||||line 5, col 27 to line 5, col 33 of module actor: 18
@!@!@ENDMSG 2221 @!@!@
@!@!@STARTMSG 2221:0 @!@!@
  ||||line 5, col 40 to line 5, col 122 of module actor: 18
@!@!@ENDMSG 2221 @!@!@
@!@!@STARTMSG 2221:0 @!@!@
  |||||line 5, col 41 to line 5, col 77 of module actor: 18
@!@!@ENDMSG 2221 @!@!@
@!@!@STARTMSG 2221:0 @!@!@
  ||||||line 5, col 42 to line 5, col 48 of module actor: 18
@!@!@ENDMSG 2221 @!@!@
@!@!@STARTMSG 2221:0 @!@!@
  ||||||line 5, col 55 to line 5, col 76 of module actor: 18
@!@!@ENDMSG 2221 @!@!@
@!@!@STARTMSG 2221:0 @!@!@
  |||||||line 5, col 56 to line 5, col 62 of module actor: 18
@!@!@ENDMSG 2221 @!@!@
@!@!@STARTMSG 2221:0 @!@!@
  |||||||line 5, col 69 to line 5, col 75 of module actor: 9
@!@!@ENDMSG 2221 @!@!@
@!@!@STARTMSG 2221:0 @!@!@
  |||||line 5, col 84 to line 5, col 121 of module actor: 9
@!@!@ENDMSG 2221 @!@!@
@!@!@STARTMSG 2221:0 @!@!@
  |||line 152, col 52 to line 152, col 55 of module actor: 18
@!@!@ENDMSG 2221 @!@!@
@!@!@STARTMSG 2221:0 @!@!@
  |||line 152, col 58 to line 152, col 104 of module actor: 18
@!@!@ENDMSG 2221 @!@!@
@!@!@STARTMSG 2221:0 @!@!@
  |||line 152, col 107 to line 152, col 114 of module actor: 18
@!@!@ENDMSG 2221 @!@!@
@!@!@STARTMSG 2221:0 @!@!@
  line 153, col 33 to line 153, col 69 of module actor: 9
@!@!@ENDMSG 2221 @!@!@
@!@!@STARTMSG 2221:0 @!@!@
  line 154, col 33 to line 154, col 75 of module actor: 9
@!@!@ENDMSG 2221 @!@!@
@!@!@STARTMSG 2221:0 @!@!@
  line 155, col 33 to line 155, col 54 of module actor: 9
@!@!@ENDMSG 2221 @!@!@
@!@!@STARTMSG 2221:0 @!@!@
  line 156, col 36 to line 156, col 46 of module actor: 9
@!@!@ENDMSG 2221 @!@!@
@!@!@STARTMSG 2221:0 @!@!@
  line 157, col 44 to line 157, col 213 of module actor: 0
@!@!@ENDMSG 2221 @!@!@
@!@!@STARTMSG 2221:0 @!@!@
  line 158, col 41 to line 158, col 225 of module actor: 9
@!@!@ENDMSG 2221 @!@!@
@!@!@STARTMSG 2221:0 @!@!@
  line 159, col 33 to line 159, col 74 of module actor: 9
@!@!@ENDMSG 2221 @!@!@
@!@!@STARTMSG 2221:0 @!@!@
  line 160, col 33 to line 160, col 38 of module actor: 9
@!@!@ENDMSG 2221 @!@!@
@!@!@STARTMSG 2221:0 @!@!@
  line 161, col 22 to line 162, col 52 of module actor: 18
@!@!@ENDMSG 2221 @!@!@
@!@!@STARTMSG 2772:0 @!@!@
<FindSuitableI line 164, col 1 to line 164, col 19 of module actor>: 1:9
@!@!@ENDMSG 2772 @!@!@
@!@!@STARTMSG 2221:0 @!@!@
  line 164, col 27 to line 164, col 52 of module actor: 639
@!@!@ENDMSG 2221 @!@!@
@!@!@STARTMSG 2221:0 @!@!@
  |line 164, col 27 to line 164, col 34 of module actor: 630
@!@!@ENDMSG 2221 @!@!@
@!@!@STARTMSG 2221:0 @!@!@
  line 165, col 30 to line 165, col 104 of module actor: 9
@!@!@ENDMSG 2221 @!@!@
@!@!@STARTMSG 2221:0 @!@!@
  line 166, col 38 to line 166, col 74 of module actor: 0
@!@!@ENDMSG 2221 @!@!@
@!@!@STARTMSG 2221:0 @!@!@
  line 167, col 38 to line 167, col 80 of module actor: 0
@!@!@ENDMSG 2221 @!@!@
@!@!@STARTMSG 2221:0 @!@!@
  line 168, col 35 to line 169, col 43 of module actor: 9
@!@!@ENDMSG 2221 @!@!@
@!@!@STARTMSG 2221:0 @!@!@
  line 170, col 27 to line 171, col 73 of module actor: 9
@!@!@ENDMSG 2221 @!@!@
@!@!@STARTMSG 2772:0 @!@!@
<DefaultsBack line 173, col 1 to line 173, col 18 of module actor>: 33:226
@!@!@ENDMSG 2772 @!@!@
@!@!@STARTMSG 2221:0 @!@!@
  line 173, col 26 to line 173, col 50 of module actor: 856
@!@!@ENDMSG 2221 @!@!@
@!@!@STARTMSG 2221:0 @!@!@
  |line 173, col 26 to line 173, col 33 of module actor: 630
@!@!@ENDMSG 2221 @!@!@
@!@!@STARTMSG 2221:0 @!@!@
  line 174, col 26 to line 174, col 92 of module actor: 226
@!@!@ENDMSG 2221 @!@!@
@!@!@STARTMSG 2221:0 @!@!@
  line 175, col 26 to line 175, col 60 of module actor: 226
@!@!@ENDMSG 2221 @!@!@
@!@!@STARTMSG 2221:0 @!@!@
  line 176, col 26 to line 176, col 55 of module actor: 226
@!@!@ENDMSG 2221 @!@!@
@!@!@STARTMSG 2221:0 @!@!@
  line 177, col 26 to line 177, col 61 of module actor: 226
@!@!@ENDMSG 2221 @!@!@
@!@!@STARTMSG 2221:0 @!@!@
  line 178, col 26 to line 178, col 70 of module actor: 226
@!@!@ENDMSG 2221 @!@!@
@!@!@STARTMSG 2221:0 @!@!@
  line 179, col 26 to line 179, col 81 of module actor: 226
@!@!@ENDMSG 2221 @!@!@
@!@!@STARTMSG 2202:0 @!@!@
End of statistics.
@!@!@ENDMSG 2202 @!@!@
@!@!@STARTMSG 2200:0 @!@!@
Progress(20) at 2022-02-20 22:42:46: 631 states generated (24 145 s/min), 210 distinct states found (8 035 ds/min), 0 states left on queue.
@!@!@ENDMSG 2200 @!@!@
@!@!@STARTMSG 2199:0 @!@!@
631 states generated, 210 distinct states found, 0 states left on queue.
@!@!@ENDMSG 2199 @!@!@
@!@!@STARTMSG 2194:0 @!@!@
The depth of the complete state graph search is 20.
@!@!@ENDMSG 2194 @!@!@
@!@!@STARTMSG 2268:0 @!@!@
The average outdegree of the complete state graph is 1 (minimum is 0, the maximum 3 and the 95th percentile is 2).
@!@!@ENDMSG 2268 @!@!@
@!@!@STARTMSG 2186:0 @!@!@
Finished in 1612ms at (2022-02-20 22:42:46)
@!@!@ENDMSG 2186 @!@!@
